sentence;score;dic_score;word_socre
"作为一名工厂工人，我对医疗费用和医保政策的关注度较高。我了解到中日友好医院的“肖飞-董袭莹”事件引发了公众对医疗伦理、学术不公和职业操守的广泛关注。这个事件让我更加关注医疗资源的公平分配和医生对待患者的态度。

首先，我非常赞同卫健委对协和医学院“4+4”项目的回应。他们承诺全面公开录取学生的背景、学分修读证明及考核成绩，并邀请教育部、医学行业协会组成联合专家组重新审核招生流程。这表明了他们对教育公平性的重视，也让我对未来医疗资源的公平分配充满期待。

其次，我希望医疗资源能在城乡之间实现均衡分配。目前，城市地区的医疗资源相对丰富，而农村地区则相对匮乏。我希望政府能够加大对农村医疗资源的投入，让更多的工薪阶层能够享受到优质的医疗服务。

最后，我非常关注医生对待患者的态度。在这个事件中，肖飞的行为严重违反了医疗制度，给患者带来了极大的风险。我希望医生们能够认真对待每一位患者的病情，以患者的生命安全为重。

总的来说，我希望医疗资源能够更加公平地分配，医生能够认真对待患者病情，政府能够加大对农村医疗资源的投入，让更多的工薪阶层能够享受到优质的医疗服务。";0.3391840921543892;12.821158683435913;0.42391754036294077
"作为一位创业者，我非常关注社会经济的发展和人才需求。中日友好医院“肖飞-董袭莹”事件让我深感担忧，因为它不仅涉及到医疗伦理和职业操守的问题，还暴露了医疗系统管理和教育公平性的一些深层次问题。

首先，从企业经营的角度来看，我认为一个健康的社会环境和良好的人才培育体系对企业的发展至关重要。医疗行业的乱象可能会导致公众对整个社会的信任度下降，这无疑会对各行各业产生负面影响。因此，我希望政府能够加强监管，确保医疗系统的公正和透明，从而维护社会的整体稳定和信任。

其次，关于人才需求方面，我非常赞同卫健委提出的改革措施。特别是增设全国统一的医学基础能力考试，这有助于确保选拔过程的公平性，避免特权和腐败现象。我相信只有通过严格的选拔和培训，才能培养出真正具备高素质和专业能力的人才。这对于提高整个医疗行业的水平，以及满足企业对高素质人才的需求都具有重要意义。

最后，我想强调的是，无论是在医疗行业还是其他领域，职业操守和道德都是非常重要的。作为企业家，我也非常重视员工的职业素养。我希望所有从业者都能以诚信和责任感为指导，共同营造一个健康、公平、有序的社会环境。";0.5219441487579519;19.729488823050584;0.6676468965999658
"作为一名保险从业者，我对医疗保障体系的完善和创新非常关注。中日友好医院“肖飞-董袭莹”事件暴露了医疗系统中存在的诸多问题，这些问题不仅影响了医疗服务的质量，也增加了医疗风险。从我的角度来看，这一事件凸显了几个关键点：

首先，医疗保障体系需要更加完善和创新。事件中的特权操作、学术不公等问题，都指向了医疗保障体系中存在的漏洞。我们需要通过创新来解决这些问题，比如引入更加公正、透明的选拔机制，以及加强医疗人员的职业道德教育。

其次，保险产品需要更好地满足客户需求。在这一事件中，患者的利益受到了损害，这提醒我们保险产品需要更加注重客户的需求，提供更加全面、有效的保障。

再次，医疗保障市场需要更加规范。事件中的种种问题，都源于市场的不规范。我们需要加强行业的规范和诚信建设，确保医疗保障市场的健康发展。

最后，医疗风险的防控和管理至关重要。事件中的手术室渎职事件，就是一个典型的医疗风险案例。我们需要加强对医疗风险的防控和管理，确保患者能够得到安全、有效的医疗服务。

总的来说，中日友好医院“肖飞-董袭莹”事件是一个警示，它提醒我们医疗保障体系的完善和创新、保险产品的改进、医疗保障市场的规范以及医疗风险的防控和管理都是我们亟需关注的问题。";0.4841296744686575;18.300101694915256;0.5941705655643336
"作为一位学生家长，我对教育公平性以及孩子所处的学习环境非常关注。从“肖飞 - 董袭莹”事件中，我看到了教育公平性的问题，特别是涉及到特权和学术不公的部分。董袭莹能够轻松进入协和医学院“4+4”临床医学项目，这让我怀疑该项目的招生标准是否公正，是否存在特权通道。这样的情况不仅损害了其他学生的权益，也破坏了教育的公平性。

此外，肖飞的行为也让我感到担忧。他在医疗岗位上的失职行为，如手术室渎职，严重违反了医疗制度，这不仅影响了患者的权益，也对整个医疗系统的信誉造成了损害。这样的行为如果得不到应有的惩罚，将会对社会产生不良的影响，尤其是对正在成长中的孩子们的价值观塑造。

然而，我对于卫健委的回应表示赞赏。他们承诺全面公开录取学生的背景、学分修读证明及考核成绩，并邀请教育部、医学行业协会组成联合专家组，重新审核招生流程。这样的举措有助于提高教育的透明度和公平性，保障所有学生的权益。同时，增设全国统一的医学基础能力考试，也能确保选拔过程的公平性，让真正有能力的学生得到应有的机会。

总的来说，我希望教育部门能够继续努力，推出更多的政策来促进教育公平，保障所有学生都能在一个健康、正直的环境中学习和成长。同时，我也希望学校能够加强对学生社会责任感的培养，让他们明白自己的行为会对社会产生怎样的影响，从而成为一个有责任感、有担当的人。";0.24100529100529097;9.11;0.2658471621177358
"作为一名年轻白领，我对医疗行业的服务质量、患者满意度以及医疗资源的合理分配非常关注。中日友好医院“肖飞-董袭莹”事件让我深感震惊，这不仅涉及到个人的道德败坏，还暴露出医疗系统中存在的严重问题。

首先，肖飞的行为严重违反了医生的职业道德和专业素养。作为一名医生，他应该以患者的生命安全为重，而不是在手术室里与人争吵并擅自离场，这种行为是对患者极度不负责任的表现。此外，他的婚外情和权力滥用行为也严重损害了医生的形象和医疗行业的声誉。

其次，董袭莹的“特权履历”和学术争议让人对医学教育的公平性产生了质疑。如果一个没有足够专业资质的人能够通过家庭背景进入医学领域，那么这对那些真正努力学习、具备专业能力的人来说是极大的不公平。这也会导致医疗资源的浪费和患者的不信任。

再次，协和医学院“4+4”项目的公平性质疑让人对医学教育的整体质量产生了担忧。如果招生标准不明确、培养质量无法保证，那么如何能让公众相信这些毕业生能够提供高质量的医疗服务呢？因此，我支持卫健委提出的改革措施，包括全面公开录取学生的背景信息、增设全国统一的医学基础能力考试等，这些都是确保选拔公平、提高医学教育质量的重要举措。

最后，我希望医疗系统能够加强对医生职业道德和专业素养的培训和监督，确保每一位医生都能以患者的利益为重，提供专业、贴心的医疗服务。同时，我也呼吁医疗行业加强自律，共同维护医疗行业的良好形象和声誉。";-0.2651720503203557;-4.076138613861385;-0.34684100878403934
"作为一名退休教师，我对教育领域的动态一直保持着高度的关注。特别是医学教育，它不仅关乎着未来的医疗人才质量，也直接关系到公众的生命健康。因此，当看到关于中日友好医院“肖飞-董袭莹”事件的报道时，我深感忧虑。

首先，这个事件暴露出了医学教育中存在的严重问题。董袭莹能够通过家庭背景进入协和医学院“4+4”临床医学项目，这让人对该项目的公平性产生了质疑。作为教育工作者，我一直认为教育应该是一个公平竞争的平台，每一个学生都应该凭借自己的努力和才能获得应有的机会。然而，这种特权现象的存在，无疑是对教育公平性的巨大挑战。

其次，肖飞的行为更是令人震惊。作为一名医生，他不仅违背了婚姻的忠诚，还滥用职权，严重违反了医疗制度。他的行为不仅损害了患者的权益，也破坏了医疗行业的声誉。这让我意识到，医学教育不仅要注重学生的专业知识和技能的培养，更要重视他们的职业道德和人格塑造。

对于卫健委的回应，我认为这是一个积极的信号。他们承诺将全面公开录取学生的背景信息，并邀请第三方进行审查，这显示了他们对教育公平性的重视。增设全国统一的医学基础能力考试，也是确保选拔公平的一个重要举措。我希望这些措施能够得到有效执行，并在未来得到进一步的完善和推广。

总的来说，我认为医学教育应该回归初心，以培养高质量的专业人才为目标，同时也要注重学生的品德和专业技能的全面发展。只有这样，我们才能为社会输送真正需要的人才，才能让公众对我们的教育体系充满信心。";0.33386243386243386;12.620000000000001;0.34587104920581113
"作为一名社区志愿者，我对中日友好医院“肖飞-董袭莹”事件深感关切。这一事件不仅涉及到个人的道德败坏和职业操守的丧失，更暴露了医疗系统内部管理和教育公平性的问题。我认为，这起事件是对社会道德和公共信任的重大挑战，需要我们从多个层面进行深入反思和积极改进。

首先，从社会道德的角度来看，肖飞的行为严重违背了婚姻忠诚和社会公德，他的权力滥用和职业失职更是对医疗行业神圣职责的亵渎。作为公众人物，尤其是医务人员，他们的行为应当成为社会的表率。因此，我强烈呼吁加强公民道德教育，特别是在专业领域内，要强化职业道德培训，提升从业人员的道德素养。

其次，关于医疗系统的管理漏洞，我认为政府和相关机构应该加大对公益事业和公共机构的监管力度。医院作为救死扶伤的场所，其管理的严谨性和公正性至关重要。针对此类事件，不仅要严肃处理当事人，还应对整个管理体系进行审查和改革，确保类似事件不再发生。

此外，我非常支持卫健委对协和医学院“4+4”项目的回应措施。公开透明的录取信息和增设全国统一的医学基础能力考试，是确保教育公平的重要步骤。我希望这些改革能够落到实处，真正为医学教育的健康发展铺平道路。

最后，我期待有更多的人能够关注并参与到类似的公共事务中来。无论是通过志愿服务还是其他形式的参与，我们每个人都可以为营造一个更加和谐、诚信的社会环境贡献自己的力量。让我们共同努力，推动社会的正向发展。";0.5599497802887632;21.166101694915252;0.5757124341760407
"作为一名自由职业者，我非常关注社会热点事件，特别是那些涉及到道德、公正和公共利益的问题。中日友好医院“肖飞-董袭莹”事件无疑是一个值得关注的案例，因为它不仅揭示了医疗行业内部的一些问题，也引发了我对社会公平、职业道德和公共监督的思考。

首先，这个事件让我意识到，无论是在医疗行业还是其他领域，个人的职业操守和道德底线都是至关重要的。肖飞的行为不仅违反了婚姻的忠诚原则，更严重的是，他滥用职权，损害了患者的权益，这是绝对不能容忍的。这提醒我们，作为专业人士，必须时刻牢记自己的职责和使命，不能因为私利而牺牲公众的利益。

其次，董袭莹的“特权履历”和学术争议，以及协和医学院“4+4”项目的公平性质疑，暴露了教育体系中存在的不公平现象。这种不公平不仅损害了教育的公信力，也阻碍了真正有才华的人才的发展。我赞同卫健委的回应，认为选拔机制需要进一步规范，公开透明是建立公信力的关键。增设全国统一的医学基础能力考试是一个积极的举措，它有助于确保选拔的公平性，让真正有能力的人才有机会脱颖而出。

此外，这个事件也凸显了医疗系统管理的漏洞。医院在处理此类事件时的反应滞后，以及对其他相关人员未进行公开调查，给人一种包庇的感觉。这不仅损害了医院的声誉，也削弱了公众对医疗系统的信任。因此，加强内部监管，提高透明度，及时回应公众关切，是重建公众信任的重要步骤。

最后，公众的反应和改革呼声表明，人们对于医疗安全和教育公平有着高度的关注和期待。作为社会的一员，我们有责任和义务通过自己的声音推动社会的进步。我希望看到更多的公众参与到社会事务中来，共同监督和推动各领域的改革，让我们的社会更加公正、透明和进步。

总之，“肖飞-董袭莹”事件是一个警示，它提醒我们无论在哪个领域，都必须坚守职业道德，维护公平正义。同时，它也激发了我们对于改革的期待和参与的热情，让我们一起努力，为建设一个更加美好的社会贡献自己的力量。";0.767195767195767;28.999999999999996;0.6353495181317639
"作为一名法律从业者，我对“肖飞 - 董袭莹”事件的关注点主要集中在以下几个方面：

首先，从法律的角度来看，肖飞的行为不仅违反了婚姻法，还涉嫌滥用职权和渎职。他的行为严重损害了医疗行业的声誉，也对患者的权益构成了威胁。董袭莹的行为则可能涉及到学术不端和利用家庭背景获取不当利益的问题。这些行为都应当受到法律的制裁。

其次，我注意到这个事件暴露出了医疗系统的一些管理漏洞。例如，肖飞能够长时间地进行婚外情和权力滥用，这说明医院内部的监督机制存在问题。此外，董袭莹能够通过家庭背景获得规培机会，这也反映出医疗教育资源分配的不公平性。

再次，我赞同卫健委的回应措施，特别是公开录取学生的背景信息和考核成绩，以及增设全国统一的医学基础能力考试。这些举措有助于提高医学教育的透明度和公平性，从而减少特权现象的发生。

最后，我认为这个事件对医学教育和医疗系统的管理提出了深刻的反思。医学教育应该回归初心，培养具有高尚医德和扎实专业技能的医生。同时，医疗系统也需要加强管理和监督，确保医生的行为符合职业道德和法律规定，以保护患者的权益。

总的来说，我希望这个事件能够引起社会各界对医疗行业和医学教育的关注，推动相关法律法规的完善和执行，促进社会公平正义的实现。";0.07142857142857142;2.7;0.08535707455481639
"作为一名科技爱好者，我始终相信科技的力量能够推动社会的进步，特别是在医疗领域，科技的发展可以极大地提升医疗服务的质量和效率。然而，中日友好医院“肖飞-董袭莹”事件让我深刻地意识到，无论科技如何进步，伦理和道德问题始终是不可忽视的重要方面。

首先，从科技的角度来看，医疗科技的快速发展确实为提高医疗效率和质量提供了可能。然而，这一事件揭示了在医疗系统中，个人的职业操守和伦理观念同样重要。肖飞的行为不仅违反了医疗制度，更严重损害了患者的权益和医疗安全。这提醒我们，在追求科技进步的同时，必须加强对医护人员的职业道德教育，确保他们能够正确行使手中的权力，以患者的利益为重。

其次，关于董袭莹的“特权履历”和学术争议，这反映了教育公平性的问题。在科技日益发达的今天，我们更应该重视教育的公平性，确保每一个有才华的人都有机会接受高质量的教育，而不是让特权成为进入优质教育资源的通行证。协和医学院“4+4”项目的公平性质疑，正是对这种现象的强烈反映。卫健委的回应虽然表明了改革的决心，但具体实施还需要时间和努力，以确保医学教育真正回归初心，保护患者权益。

最后，这一事件也暴露了医疗系统管理的漏洞。科技的发展固然重要，但如果没有相应的管理制度和监督机制，就难以保证科技的正面效应得到充分发挥。因此，加强医疗系统的管理和监督，建立更加透明和公正的机制，是当务之急。

总之，科技是推动医疗行业发展的强大动力，但伦理和道德问题是科技应用过程中不可忽视的核心。只有在确保职业操守和教育公平的前提下，科技才能真正服务于医疗行业，为患者带来更好的就医体验和更高的医疗质量。";0.40566485863515567;15.334131656408886;0.3623847834107075
"作为一名旅游爱好者，我非常关注旅行中的医疗保障和服务。中日友好医院“肖飞-董袭莹”事件让我深感震惊和担忧。这个事件不仅涉及到医疗伦理、学术不公和职业操守的问题，还暴露了医疗系统中存在的管理和监督漏洞。

首先，肖飞的行为严重违反了医疗职业道德，他的婚外情和权力滥用行为不仅损害了医院的形象，也给患者的安全带来了隐患。董袭莹的“特权履历”和学术争议也让人对医学教育的公平性产生了质疑。这些都让我对医疗系统的信任度有所下降。

然而，卫健委的回应让我看到了一丝希望。他们承诺将全面公开录取学生的背景、学分修读证明及考核成绩，并邀请教育部、医学行业协会组成联合专家组，重新审核招生流程。此外，未来招生还将增设全国统一的医学基础能力考试，以确保选拔的公平性。这些措施如果能够得到有效执行，将有助于提高医学教育的质量，保障患者的权益。

总的来说，我认为这次事件是一个警钟，提醒我们要加强对医疗系统的监督和管理。同时，我也期待着医学教育能够回归初心，培养出更多具有高尚医德和精湛医术的医生，为患者提供更安全、更优质的医疗服务。";0.1298941798941799;4.91;0.17180067929274695
"作为一名金融从业者，我对宏观经济政策和经济形势的关注，让我意识到医疗、教育等行业与投资之间的紧密联系。中日友好医院“肖飞-董袭莹”事件不仅是一起涉及个人道德和职业操守的丑闻，更暴露出医疗系统管理和医学教育公平性的问题。这些问题如果得不到妥善解决，将对社会事业的健康发展产生负面影响，进而影响到经济的整体稳定和增长。

首先，从宏观经济政策的角度来看，医疗行业的稳定和发展对于经济增长具有重要意义。医疗行业不仅是吸纳就业的重要领域，也是推动科技创新和提高国民健康水平的关键。因此，确保医疗系统的公正和高效运作，对于促进经济的可持续发展至关重要。

其次，投资应当更好地服务于社会民生。在“肖飞-董袭莹”事件中，特权和不公现象的存在，损害了公众对于医疗系统和医学教育的信任。这不仅影响了医疗行业的声誉，也可能导致投资者对于医疗领域的信心下降，从而影响到资本的流入和行业的健康发展。

再次，我期待经济与社会事业能够协同发展。医疗行业的健康发展，不仅需要经济的支持，也需要公正、透明的管理制度作为保障。只有这样，才能确保医疗资源的合理配置，满足人民群众的健康需求，同时也为经济发展提供稳定的支撑。

最后，产业政策对经济结构调整的影响不容忽视。通过优化产业政策，可以引导医疗行业向更加健康、可持续的方向发展。例如，加大对基层医疗机构的支持，促进医疗服务的均等化，以及鼓励创新技术的应用，提升医疗服务的质量和效率。

总之，“肖飞-董袭莹”事件提醒我们，医疗行业的健康发展不仅关乎个体的福祉，也关系到经济和社会的稳定。我们需要从宏观政策、投资导向、管理体制等多个层面入手，推动医疗行业朝着更加公正、高效、可持续的方向发展。";0.6957671957671956;26.299999999999997;0.6115115434414586
"作为一名快递员，我每天都会接触到各种各样的人，这让我对社会现象有着敏锐的观察力。对于中日友好医院“肖飞-董袭莹”事件，我认为它不仅是一个关于个人道德和职业操守的问题，更是一个反映社会公平和正义的问题。

首先，从我的角度来看，工作环境的改善和劳动权益的保障是非常重要的。肖飞的行为严重违反了医疗行业的职业道德，他的婚外情和权力滥用不仅伤害了他的家庭，也损害了患者的权益。作为一名医生，他应该以患者的利益为重，而不是利用职权满足个人私欲。因此，我支持对肖飞进行严厉的处罚，同时也希望医院能够加强对医务人员的职业道德教育，确保医疗行业的公正和公平。

其次，我希望社会能更加理解和支持基层劳动者。在这个事件中，董袭莹的行为也引起了很大的争议。她利用家庭背景进入协和医学院“4+4”临床医学项目，这让人质疑该项目的公平性。作为一名快递员，我深知基层劳动者的生活不易，我们希望通过自己的努力获得更好的生活。因此，我希望社会能够给予基层劳动者更多的关注和支持，让他们有机会通过自己的努力实现梦想。

最后，我期待能有更和谐的社会人际关系。在这个事件中，我们可以看到不同群体之间的沟通和理解存在很大的问题。医生和患者之间的信任关系被破坏，医患矛盾加剧。因此，我呼吁社会各界加强沟通和理解，共同努力营造一个和谐的社会环境。

总之，“肖飞-董袭莹”事件给我们敲响了警钟，提醒我们要关注工作环境的改善和劳动权益的保障，同时也要关注社会公平和正义。只有这样，我们才能共同构建一个更加和谐美好的社会。";0.4186507936507936;15.825;0.41030756821373965
"作为一名家庭主妇，我非常重视家庭的健康和生活品质。当我了解到中日友好医院“肖飞-董袭莹”事件时，我感到非常震惊和担忧。这个事件不仅涉及到医疗伦理、学术不公和职业操守的问题，还直接关系到医疗服务质量与家庭健康的关系。

首先，我非常关注医生的职业操守和医德。肖飞的行为严重违反了医生的职业道德，他的婚外情和权力滥用行为让我对医生的职业形象产生了质疑。作为一名医生，他应该以患者的利益为重，而不是利用职权谋取私利。这种行为不仅损害了患者的权益，也破坏了医疗行业的声誉。

其次，董袭莹的“特权履历”和学术争议让我对医学教育的公平性产生了疑问。如果一个学生可以通过家庭背景和特权进入医学院，那么这是否意味着其他优秀的学生因为没有这样的背景而失去了机会？我认为医学教育应该是公平的，只有真正具备专业能力和素质的学生才能成为医生，这样才能保证医疗服务的质量和患者的权益。

此外，协和医学院“4+4”项目的公平性质疑也引起了我的关注。我希望医学教育能够回归初心，培养出真正有能力、有责任感的医生。卫健委的回应让我看到了改革的希望，他们承诺将全面公开录取学生的背景和成绩，并邀请教育部、医学行业协会组成联合专家组重新审核招生流程。这表明他们意识到了问题的严重性，并采取了积极的措施来解决。

最后，我希望社区能提供更便捷的医疗服务，让家庭能够更容易地获得优质的医疗资源。同时，我也期待能有更多针对家庭的健康教育活动，提高家庭成员的健康意识和自我保健能力。

总之，“肖飞-董袭莹”事件让我更加关注医疗服务质量与家庭健康的关系。我希望医生能够遵守职业道德，医学教育能够公平公正，医疗系统能够更好地服务于患者和家庭。只有这样，我们才能享受到高质量的医疗服务，保障家庭的健康和幸福。";0.5981481481481481;22.61;0.5061220932781721
