sentence;score;dic_score;word_socre
"作为一位商场导购员，我每天需要长时间站立，这让我非常关注腿部健康，尤其是静脉曲张的问题。我了解到，长时间站立会导致腿部血液循环不畅，增加患静脉曲张的风险。因此，我特别希望商场能够提供一些腿部保健设施，比如设置休息区，配备腿部按摩设备，这样可以让我们在工作间隙得到适当的放松和恢复。

关于中日友好医院“肖飞董袭莹”事件，我认为这不仅是一个涉及个人道德和职业操守的问题，更暴露了医疗系统管理和教育公平性的一些深层次问题。首先，肖飞的行为严重违反了医疗职业道德，他的婚外情和权力滥用行为不仅伤害了家庭，也损害了患者的权益和医疗安全。其次，董袭莹的“特权履历”和学术争议，以及协和医学院“4+4”项目的公平性质疑，都指向了一个问题：在医学教育和医疗行业中，是否存在不公平的特权通道？

我支持卫健委对协和医学院“4+4”项目的改革举措，特别是公开录取学生的背景、学分修读证明及考核成绩，邀请第三方机构重新审核招生流程，以及增设全国统一的医学基础能力考试。这些措施有助于提高医学教育的公平性和透明度，确保只有具备过硬专业能力的人才能成为医生，从而更好地守护患者的生命。

此外，我也希望商场能够借鉴这种透明和公正的原则，关注员工的健康和福利，提供必要的腿部保健设施和培训，以减轻长时间站立对腿部健康的不利影响。通过这样的方式，商场不仅能够提升员工的工作满意度和忠诚度，也能为顾客提供更好的服务体验。";0.2492101556849758;9.420143884892086;0.25622545164103644
"作为一名印刷厂工人，我对中日友好医院“肖飞-董袭莹”事件的关注点主要集中在职业健康防护和公正性方面。首先，我非常关注印刷厂工人的职业健康防护问题，这让我对医疗行业的职业操守和医疗安全产生了共鸣。肖飞医生的行为不仅违反了医疗伦理，还可能对患者的健康造成严重影响。这让我意识到，无论是在医疗行业还是在印刷行业，职业操守和对公众健康的负责都是非常重要的。

其次，我希望印刷厂能提供更有效的防护用品，以保障我们的健康。这与肖飞事件中的医疗失职问题有相似之处。如果医疗人员不能正确使用防护用品或遵守医疗规程，那么他们的行为可能会对患者造成伤害。同样，如果印刷厂工人没有得到适当的防护用品，我们的健康也可能受到威胁。

此外，我期待对工人进行职业健康知识培训，以便我们更好地了解如何保护自己免受有害物质的影响。这与肖飞事件中对协和医学院“4+4”项目公平性的质疑有关。如果教育体系存在不公平现象，那么那些真正有能力的人可能无法获得应有的机会。因此，我认为无论是医疗行业还是教育领域，都应该注重公平性和透明度。

最后，我关注印刷工作中对皮肤和呼吸道健康有影响的因素及改善。这与肖飞事件中对医疗安全的关注是一致的。我们都希望工作环境能够尽可能地安全，以保护我们的健康。因此，我认为无论是医疗行业还是印刷行业，都应该加强职业健康防护，以确保员工的安全和健康。

总之，作为一名印刷厂工人，我对中日友好医院“肖飞-董袭莹”事件的关注点主要集中在职业健康防护和公正性方面。我希望印刷厂能提供更有效的防护用品，并对工人进行职业健康知识培训。同时，我也关注印刷工作中对皮肤和呼吸道健康有影响的因素及改善。这些关注点与肖飞事件中的医疗失职、教育公平等问题有一定的联系。";0.8730158730158729;33.0;0.7186154514383333
"作为一位汽车修理工，我主要关注的是职业健康和安全问题。虽然我的工作环境和医疗领域有很大的不同，但我认为每个行业都应该重视员工的健康和安全。因此，我对中日友好医院“肖飞-董袭莹”事件的看法主要集中在以下几个方面：

首先，我认为任何行业的从业者都应该遵守职业道德和职业操守。肖飞的行为不仅违反了婚姻道德，还涉嫌滥用职权，这在任何行业中都是不可接受的。他的行为不仅损害了个人声誉，也对医院的公信力造成了严重损害。

其次，董袭莹的“特权履历”和学术争议让我感到担忧。在任何行业，都应该公平竞争，而不是依靠家庭背景或其他非专业因素获得优势。这不仅影响了其他人的机会，也可能会导致不合格的人才进入行业，从而影响到整个行业的质量和声誉。

再次，医疗系统的管理漏洞也是我关注的问题。在汽车修理行业，我们也需要严格的管理制度来保证员工的安全和健康。如果管理不到位，就可能导致事故的发生。同样，医疗系统也需要严格的管理制度来保证医疗质量和患者安全。

最后，我支持卫健委的回应和改革措施。公开透明的选拔机制和严格的考核标准是保证行业公平和质量的重要手段。我希望这些改革措施能够得到有效的执行，以恢复公众对医疗系统的信任。

总的来说，我认为无论是医疗行业还是汽车修理行业，都应该重视职业道德、公平竞争和严格管理。只有这样，我们才能保证行业的健康发展和员工的健康安全。";0.37400793650793646;14.1375;0.4142362635746272
"作为一名酒店前台，我对中日友好医院“肖飞-董袭莹”事件的关注点主要集中在职业操守、公平性以及对个人生活的影响上。这个事件不仅涉及到医疗伦理和学术公正的问题，也反映了职场中的一些普遍问题，比如权力滥用、不公平竞争和个人隐私的保护。

首先，从职业操守的角度来看，肖飞的行为严重违反了医生的职业道德。作为医务人员，他们应该以患者的利益为重，而不是利用职务之便满足个人私欲。这不仅损害了患者的权益，也破坏了医疗行业的公信力。我认为，无论是在医疗行业还是酒店行业，职业道德都是我们工作的基石，任何违背这一原则的行为都应该受到严厉的谴责和惩罚。

其次，关于公平性的问题，董袭莹的“特权履历”引发了人们对教育公平性的质疑。在酒店行业中，我们也经常面临类似的问题，比如某些员工可能因为家庭背景或者人际关系而获得更多的晋升机会或者更好的工作条件。这种不公平的现象不仅会挫伤其他员工的积极性，也会损害整个团队的凝聚力和工作效率。因此，我支持卫健委提出的改革措施，希望通过更加透明和公正的选拔机制来保证教育和就业的公平性。

最后，这个事件还让我想到了个人生活和职业生活的平衡问题。作为一名酒店前台，我的工作时间不固定，经常需要熬夜值班，这对我的睡眠健康造成了很大的影响。虽然我了解一些助眠技巧，但是长期的熬夜还是会对身体造成伤害。因此，我非常关注酒店是否能够提供更好的睡眠保障措施，比如优化值班安排、提供助眠设施等。同时，我也希望能够接受更多关于睡眠健康的培训，以便更好地保护自己的身体健康。

总的来说，“肖飞-董袭莹”事件给我带来的启示是：无论在哪个行业，我们都应该坚守职业道德，追求公平正义，同时也要关注自身的健康和福祉。只有这样，我们才能在职业生涯中取得成功，同时也能够享受健康快乐的生活。";0.38359788359788355;14.5;0.32357583818165686
"哎呀，这个事情真是让人唏嘘啊。我虽然是个菜市场摊主，每天起早贪黑的，但也知道医者父母心的道理。这个“肖飞董袭莹”事件，真是把医生这个职业的形象给抹黑了。

首先，我觉得肖飞这个人，不仅违反了婚姻道德，还滥用职权，这在任何行业都是不能容忍的。特别是他还在手术室渎职，这是拿患者的生命开玩笑啊。这种人就应该受到严厉的惩罚，不只是开除那么简单。

至于董袭莹，她的问题在于利用家庭背景获得不公平的优势。我们这些小摊贩，虽然没有高深的知识，但也知道公平竞争的重要性。如果一个医生都能通过特权进入岗位，那我们这些普通人还有什么希望呢？

还有那个协和医学院的“4+4”项目，听起来好像是为了培养优秀的人才，但如果里面充满了不公平，那还有什么意义呢？我倒是觉得卫健委的回应还算及时，至少他们愿意公开信息，接受监督。增设全国统一的医学基础能力考试也是个好主意，这样大家就站在同一起跑线上了。

说到底，无论是医生还是我们这些摊主，都应该靠自己的本事吃饭。我希望市场管理部门也能像卫健委一样，多关心一下我们的健康，比如提供一些休息座椅，或者组织一些健康保健的培训。毕竟，我们也是为社会服务的一份子，我们的健康同样重要。";0.0988980387476628;3.7383458646616545;0.12954681766988618
"作为一名服装店店员，我确实很少直接接触到医疗领域的事务，但“肖飞 - 董袭莹”事件所揭示的问题，却让我深感共鸣。在我们的日常工作中，也面临着类似的职业道德、公平竞争以及健康保护等问题。

首先，关于职业道德，我认为无论是医生还是店员，都应该坚守自己的职业操守。肖飞医生的行为不仅损害了患者的权益，也破坏了医疗行业的声誉。这让我想到，在服装销售过程中，我们也需要诚实守信，不能为了业绩而误导顾客，损害他们的利益。

其次，关于公平竞争，董袭莹的“特权履历”引发了我对职场公平性的思考。在服装行业，我们也经常看到有些人因为家庭背景或者人际关系而获得更好的职位或待遇，这对于我们这些靠自己努力打拼的人来说，是非常不公平的。我希望我们的行业也能像卫健委对协和医学院的要求一样，通过透明的选拔机制，确保每个人都能在公平的环境下竞争。

最后，关于健康保护，虽然我们的工作环境与医疗领域有很大差异，但长时间的站立和接触各种衣物，也会对皮肤健康造成一定的影响。我非常赞同卫健委提出的改革方向，特别是对于职业健康保护的重视。我希望我们的服装店也能提供相应的皮肤保护用品，合理安排工作时间，以及对店员进行皮肤护理知识的培训，以减少工作对皮肤健康的不良影响。

总的来说，“肖飞 - 董袭莹”事件给我带来的不仅仅是对医疗行业的反思，更多的是对自己所在行业的思考和期待。我希望我们每个人都能在自己的岗位上，坚守职业道德，追求公平竞争，同时也关注自身的健康保护。";0.31746031746031744;12.0;0.32154337874428973
"作为一位停车场管理员，我每天需要长时间在户外工作，因此我对防晒和皮肤健康非常关注。我了解到紫外线对皮肤的伤害很大，所以我会尽量采取一些措施来保护自己，比如使用防晒霜、戴帽子和太阳镜等。同时，我也希望停车场能够提供一些防晒设施，比如遮阳棚或者防晒用品，这样可以更好地保护我们的皮肤健康。

关于中日友好医院“肖飞-董袭莹”事件，我认为这是一件非常严重的医疗丑闻。肖飞的行为不仅违反了医疗伦理和职业操守，还可能对患者的健康造成威胁。董袭莹的“特权履历”也引发了人们对医学教育公平性的质疑。我认为医学教育应该回归初心，保护患者权益，而不是成为某些人利用权力和资源谋取私利的工具。

对于卫健委的回应，我认为这是一个积极的举措。公开录取学生的背景和成绩，以及增设全国统一的医学基础能力考试，可以提高医学教育的公平性和透明度。我希望这些措施能够得到有效执行，并且能够真正起到改善医学教育质量的作用。

总的来说，我认为防晒和皮肤健康是非常重要的，尤其是在户外工作的人群更需要注意。同时，我们也需要关注医疗领域的公平性和透明度，以保障患者的安全和权益。";0.17989417989417986;6.8;0.23451640685767733
"作为一位快递分拣员，我对中日友好医院“肖飞董袭莹”事件的关注点主要集中在职业操守、工作环境和健康管理方面。首先，我非常关注肖飞医生的行为，他不仅违反了医疗伦理，还滥用职权，这让我感到非常失望。作为一名医护人员，他应该以患者的利益为重，而不是利用职务之便满足个人私欲。这种行为严重损害了医疗行业的形象，也影响了患者的权益。

其次，关于董袭莹的“特权履历”和学术争议，我认为这反映了教育公平性的问题。如果一个学生能够通过家庭背景获得不公平的优势，那么这对其他努力学习的学生来说是非常不公平的。我希望所有的学生都能在一个公平的环境中竞争，这样才能真正体现个人的能力和价值。

最后，我注意到卫健委已经对此事做出了回应，并提出了改进措施。我对此表示支持，因为只有通过公开透明的选拔机制，才能保证医学教育的公平性和质量。同时，我也希望快递公司能够借鉴这种做法，为员工提供更好的工作环境和健康管理措施。例如，可以配备手部和腰部按摩设备，合理安排工作量，以及进行相关的保健知识培训。这样不仅可以提高员工的工作效率，也能保障他们的身体健康。";0.1111111111111111;4.2;0.14767467857938965
"作为一名家具安装工，我对中日友好医院“肖飞-董袭莹”事件的关注点主要集中在职业操守、健康风险以及管理和培训的问题上。虽然我的工作领域与医疗行业不同，但我认为任何行业都应该重视员工的职业道德和健康安全。

首先，从职业操守的角度来看，肖飞的行为明显违背了医生的职业道德，他的婚外情和权力滥用不仅损害了个人声誉，也破坏了医疗行业的形象。这让我联想到在家具安装行业中，我们也需要遵守职业道德，比如诚实报价、按时完成工作等。如果有人利用职务之便谋取私利，同样会损害整个行业的信誉。

其次，从健康风险的角度来看，肖飞和董袭莹的行为可能导致医疗事故，危及患者的生命安全。这与我在家具安装工作中关注的腰部和手部健康问题有相似之处。搬运和安装家具时，如果不注意防护，容易造成伤害。因此，我认为无论是医疗行业还是家具安装行业，都应该重视员工的健康和安全，提供必要的防护工具和培训。

最后，从管理和培训的角度来看，中日友好医院在处理此事时显得反应滞后，有包庇之嫌。这反映出医院在管理和监督方面存在问题。同样地，我也希望家具公司能够加强对员工的安全培训，提高大家的安全意识。只有这样，我们才能更好地保护自己和他人的健康和安全。

总之，“肖飞-董袭莹”事件给我带来的启示是：无论在哪个行业，我们都应该遵守职业道德，关注自身和他人的健康安全，同时也需要加强管理和培训，以提高整个行业的水平。";0.4497354497354497;17.0;0.467690162531055
"哎呀，这个事情真是让人头疼啊。我虽然是个水产摊主，平时关注的是怎么让我的鱼虾卖得更好，但是看到这样的新闻，我还是忍不住要说几句。

首先，我觉得这个肖飞和董袭莹的事情，真的是太不负责任了。作为一个医生，肖飞应该知道自己的行为会对病人造成多大的影响。手术室里怎么能因为个人情绪就离开呢？这不仅是对病人的不负责，也是对整个医疗行业的不尊重。至于董袭莹，如果真的有问题，那也应该通过正规途径去解决，而不是利用家庭背景来走捷径。

再说说这个“4+4”项目的问题，我虽然不懂什么高深的医学知识，但是我也知道，教育应该是公平的。如果一个项目总是被质疑有特权通道，那它还有什么公信力可言？现在卫健委说要公开录取学生的背景和成绩，还要增设全国统一的考试，我觉得这是个好事情。只有真正有能力的人才能成为医生，这样才能保证我们的健康安全。

最后，我想说的是，不管是医生还是水产摊主，我们都要对自己的工作负责。我每天在潮湿的环境下工作，虽然很辛苦，但是我还是会注意关节的保养，也会希望市场能给我们提供更好的工作环境。同样，医生们也应该对自己的职业操守负责，这样才能赢得患者的信任和社会的尊重。";-0.07557108283395203;-1.1616541353383458;-0.12262477591924291
"作为一名手机维修员，我对中日友好医院“肖飞-董袭莹”事件的关注点主要集中在职业操守、公平性以及健康管理方面。首先，肖飞的行为严重违背了职业道德，他的婚外情和权力滥用不仅损害了个人声誉，也破坏了医疗行业的形象。这让我意识到，无论是在医疗行业还是手机维修领域，我们都应该坚守职业道德，尊重客户和同事，避免滥用职权。

其次，董袭莹通过家庭背景获得的“特权履历”引发了我对教育公平性的思考。在手机维修行业中，我们也需要公正、透明的选拔机制，让真正有能力、热爱这个行业的人有机会脱颖而出。我支持卫健委提出的改革措施，特别是增设全国统一的医学基础能力考试，这有助于确保选拔过程的公平性。

最后，从健康管理的角度来看，肖飞和董袭莹的事件提醒我们在忙碌的工作中也要关注自身的健康。虽然我的工作环境与医疗行业不同，但长时间低头工作同样可能对颈椎造成伤害。因此，我赞同维修店提供颈椎保健设施，如颈椎按摩仪和可调节高度的工作台，以减轻颈椎压力。同时，我也希望公司能够组织颈椎保健知识培训，帮助我们更好地了解如何在工作中保护颈椎健康。

总之，中日友好医院“肖飞-董袭莹”事件不仅暴露了个别医务人员的职业道德问题，还引发了对教育公平性和健康管理的深刻反思。作为手机维修员，我从中得到了警示，要在工作中坚守职业道德，关注教育公平，并重视颈椎健康。";0.5291005291005291;20.0;0.5789502602557827
"作为一名花店员工，我非常关注自身的腰部健康，因为长时间的弯腰工作确实给我的身体带来了一定的压力。看到中日友好医院“肖飞-董袭莹”事件，我首先想到的是，无论是在医疗行业还是在我们这样的服务行业中，职业操守和公正都是非常重要的。

从这个事件中，我们可以看到，如果一个人滥用职权，不仅会损害他人的利益，也会破坏整个行业的公正性。就像肖飞那样，他的行为不仅伤害了他的家人，也影响了医院的工作秩序，甚至可能影响到患者的治疗效果。

这让我想到了我们花店的工作环境。虽然我们的工作不像医生那样直接关系到人的生命安全，但是长时间的弯腰工作同样可能对我们的身体健康造成影响。因此，我也希望我们的花店能够更加关注员工的健康，比如提供腰部按摩设备，合理安排工作时间，或者对我们进行一些腰部保健的知识培训。

总的来说，无论是医疗行业还是我们这样的服务行业，都应该注重职业操守和员工的健康。只有这样，我们才能为顾客提供更好的服务，同时也保护好自己的身体。";0.3846123244619485;14.538345864661654;0.5954056253939141
"作为一名面包师，我非常关注职业健康防护问题，尤其是在长时间接触高温和面粉的环境中工作。虽然我的职业与医疗行业不同，但我仍然对中日友好医院“肖飞-董袭莹”事件感到震惊和担忧。这不仅涉及到医疗伦理和学术公正的问题，也反映了职业操守和管理漏洞的重要性。

首先，我认为无论是在医疗行业还是面包制作行业，职业操守都是至关重要的。肖飞的行为不仅违反了医疗伦理，还损害了患者的权益。这让我意识到，在任何行业中，我们都应该遵守职业道德，尊重他人的权益，确保工作的质量和安全性。

其次，事件中提到的医疗系统的管理漏洞也引起了我的共鸣。在面包店的工作中，我也希望管理层能够重视员工的健康防护，提供有效的防护用品，并改善通风条件。这不仅是对员工健康的负责，也是对产品质量的保证。因此，我支持公众对于医疗系统管理改革的呼声，希望类似的问题能够在各个行业中得到重视和解决。

最后，我注意到卫健委对于协和医学院“4+4”项目的回应，他们承诺将全面公开录取学生的背景和成绩，并增设全国统一的医学基础能力考试。这让我感到欣慰，因为只有通过公平、透明的选拔机制，才能确保医学教育的质量和公正性。同样地，我也期待在面包制作行业中，能够有更多的职业健康知识培训，提高员工的防护意识和技能。

总之，虽然我的职业与医疗行业不同，但“肖飞-董袭莹”事件让我更加关注职业操守、管理漏洞以及职业健康防护问题。我希望在各个行业中，我们都能共同努力，营造一个安全、公正、健康的工作环境。";0.6351851851851851;24.009999999999998;0.6433547103041996
"作为一名健身房教练，我非常关注关节和肌肉健康，以及运动损伤的预防和康复。在阅读了关于中日友好医院“肖飞董袭莹”事件的报道后，我认为这个事件不仅涉及到医疗伦理和学术公正的问题，也让我思考了我们在健身行业如何更好地保护自己和会员的健康。

首先，从我的角度来看，健身房教练的工作环境和压力可能会对关节和肌肉造成一定的负担。因此，我非常赞同健身房应该提供更多的康复设备，并加强对教练的安全培训。这样不仅可以帮助我们更好地恢复身体，也可以提高我们的专业技能，从而更好地指导会员进行科学锻炼。

其次，我认为健身房也应该加强对教练的运动康复知识培训。这不仅可以帮助我们更好地预防运动损伤，也可以让我们在面对突发情况时能够及时采取正确的应对措施。此外，这种培训还可以提高我们的专业素养，增强会员对我们的信任。

最后，我也关注到健身房工作中可能存在的对关节和肌肉健康不利的因素。例如，长时间站立或重复性的动作可能会对关节造成压力。因此，我们需要定期进行身体检查，及时发现并解决潜在的健康问题。同时，我们也需要合理安排工作和休息时间，避免过度劳累。

总之，我认为健身房教练的关节和肌肉健康保护措施非常重要。我们应该积极寻求各种方式来提高自己的康复知识和技能，同时也需要关注工作环境中的潜在风险因素。只有这样，我们才能更好地保护自己和会员的健康，为他们提供更专业的服务。";0.4391534391534391;16.599999999999998;0.4584354417128835
